title,link,snippet
Andrea Bos on LinkedIn: #hydrogenpark #eni #sapio #edf #edison ...,https://www.linkedin.com/posts/andrea-bos-8a796819_hydrogenpark-eni-sapio-activity-7118620618412953600-ljD3?trk=public_profile_like_view,"3 days ago ... ... Idrogeno Giancarlo Zema Andrea Bos Angelo Minotti Marcello Merlino #idrogeno ... L'#UnioneEuropea aumenta a 4,5 € /Kg i sussidi per i produttori di ..."
"Tgcom24 su LinkedIn: Gme, prezzo dell'elettricità oltre i 100 euro a ...",https://it.linkedin.com/posts/tgcom24_gme-prezzo-dellelettricit%C3%A0-oltre-i-100-activity-7099723169321672704-jC7a,"1 day ago ... ... euro a Megawattora (+10% sulla settimana precedente). Gme, prezzo dell'elettricità oltre i 100 euro a Mwh."
Watergas | LinkedIn,https://www.linkedin.com/company/watergas/,2 days ago ... ... idrogeno #accadueo #water #acqua #servicestation #fuelsmobility ... gpl #metano #CCS #depurazione #servizioidrico #rigassificatore #biometano ...
Hydronews su LinkedIn: #idrogeno #hydrogen,https://it.linkedin.com/posts/hydronews_idrogeno-hydrogen-activity-7037063003376091137-7c8h?trk=public_profile_like_view,13 hours ago ... Altri post rilevanti · Materie prime e idrogeno rinnovabile: l'Europa si impegna a investire 1 miliardo di euro in Namibia - HydroNews · Per la prima volta l' ...
"L'idrogeno, il vettore energetico del futuro. Opportunità di investimento",https://it.linkedin.com/pulse/lidrogeno-il-vettore-energetico-del-futuro-di-alessandro-fatichi-rmgif,"3 days ago ... Queste celle trasformano l'idrogeno e l'ossigeno in acqua, producendo elettricità nel processo. ... investimento di 3,64 miliardi di euro per lo sviluppo di ..."
Gabriella Rocco su LinkedIn: #unicorno #startup #round #idrogeno ...,https://it.linkedin.com/posts/gabriella-rocco-3497aa4_unicorno-startup-round-activity-7115631917210742784-RUam?trk=public_profile_like_view,"Oct 18, 2023 ... ... idrogeno verde rinnovabile. Per affrontare la sfida climatica globale ... milione di euro (limite massimo da atto notarile). Nel 2020, appena chiusa ..."
Elettricità Futura | LinkedIn,https://www.linkedin.com/company/elettricitafutura/,"6 days ago ... ... euro, rendendo impossibile raggiungere il target nazionale di #decarbonizzazione ... L'#efficienzaenergetica e la crescita dell'#elettricità rinnovabile sono ..."
Hydronews su LinkedIn: #hydrogen #ammonia #shipping,https://it.linkedin.com/posts/hydronews_hydrogen-ammonia-shipping-activity-7056999885346095104-3WmW?trk=public_profile_like_view,1 day ago ... Snam conferma: la dorsale italiana dell'H2 candidata per i Projects of Common Interest (PCI) europei - HydroNews · Materie prime e idrogeno rinnovabile: l'Europa ...
"ENEA su LinkedIn: Maire Tecnimont, 194 milioni per Hydrogen ...",https://it.linkedin.com/posts/enea_2_maire-tecnimont-194-milioni-per-hydrogen-activity-6979057442441564161-JKax?trk=public_profile_like_view,7 days ago ... idrogeno #IPCEI #HydrogenValley Contributo di 194 milioni di euro a NextChem ... investimento complessivo di 500 milioni di euro. Sarà il primo incubatore ...
Samso Spa su LinkedIn: Energia rinnovabile per la terracotta di ...,https://it.linkedin.com/posts/samso-spa_energia-rinnovabile-per-la-terracotta-di-activity-6943144461396795392-BTZF?trk=public_profile_like_view,"8 days ago ... ✓ Importo della comessa circa € 4 milioni, totalmente in E.S.Co senza quindi investimento ... Turismo in Campania, 1 milione di fondi europei per la mobilità ..."
Roberto Canu su LinkedIn: #hydrogen #idrogeno #gbsols #lakenergy,https://it.linkedin.com/posts/roberto-canu-2a53731_hydrogen-idrogeno-gbsols-activity-6988554603571089408-rhHR?trk=public_profile_like_view,"Oct 17, 2023 ... ✓5 milioni di euro previsti di fatturato nel 2027. ✓Come startup innovativa, Lakenergy consente ai propri investitori di detrarre il 30% del loro investimento ..."
SEVA energia rinnovabile | LinkedIn,https://pl.linkedin.com/company/s-e-v-a-srl-societ%C3%A0-benefit,"Oct 16, 2023 ... ... bilancio come una delle riforme allo studio dell'esecutivo --> https://lnkd ... euro al megawattora per un periodo di 20 anni. ▷ Sarebbe quindi privo di ..."
luciano castellin su LinkedIn: Ecomembrane brevetta un nuovo ...,https://it.linkedin.com/posts/luciano-castellin-272a283b_ecomembrane-brevetta-un-nuovo-sistema-di-activity-7065251209850290176-p_Vt?trk=public_profile_like_view,1 day ago ... Ecomembrane brevetta un nuovo sistema di stoccaggio per l'idrogeno a bassa pressione https://lnkd.in/dB3tMfpM.
Regione Piemonte su LinkedIn: #idrogeno #pnrr,https://it.linkedin.com/posts/regione-piemonte_idrogeno-pnrr-activity-7003659121518370816-fbxk?trk=public_profile_like_view,"4 days ago ... ... euro (micro e piccole imprese) o 250.0000 euro (medie imprese). Potranno ... € 1.200) erogate dalla Regione Piemonte, a copertura della quasi totalità dei ..."
"Legalcommunity.it su LinkedIn: Idrogeno e PNRR, Fraccastoro vince ...",https://www.linkedin.com/posts/legalcommunity.it_idrogeno-e-pnrr-fraccastoro-vince-per-cva-activity-7079385614114017280-E9k-?trk=public_profile_like_view,"7 days ago ... ... idrogeno prodotto da fonti rinnovabile in aree industriali dismesse, da finanziare nell'ambito del Piano nazionale di ripresa e resilienza (#PNRR). Leggi l ..."
Federica Fugaro su LinkedIn: Motori a idrogeno e carburanti ...,https://it.linkedin.com/posts/federica-fugaro-72ba0a124_motori-a-idrogeno-e-carburanti-alternativi-activity-7071833019950505984-akBi?trk=public_profile_share_view,14 hours ago ... ... idrogeno (ex Gm) guidato da Pierpaolo ... Together we will join forces for the development of the Euro VI and Euro ...
Materia Rinnovabile - Renewable Matter | LinkedIn,https://it.linkedin.com/showcase/materia-rinnovabile---renewable-matter/,"Oct 16, 2023 ... Materia Rinnovabile - Renewable Matter ... Un obiettivo che non può essere raggiunto senza un #investimento nella ricerca scientifica interna all'Alleanza."
Attilio Falini su LinkedIn: #rinnovabili #fotovoltaico #fotovoltaico ...,https://it.linkedin.com/posts/attilio-falini_rinnovabili-fotovoltaico-fotovoltaico-activity-7071789998051667969-2Dlz?trk=public_profile_like_view,14 hours ago ... Sempre ricordandosi dell'aspetto più importante di tutti: l'investimento nel rinnovabile ... elettricità ⚡e 30 €/MWh il #gas ... purtroppo sembra che risalga ...
Hydronews su LinkedIn: Il Comune di Brescia: “I treni a idrogeno del ...,https://it.linkedin.com/posts/hydronews_il-comune-di-brescia-i-treni-a-idrogeno-activity-7001829677187121152-TvD2?trk=public_profile_like_view,"Oct 16, 2023 ... Oltre 220 milioni di euro di investimenti e 30 MW di elettrolisi: il ... Idrogeno HESE - Hydrogen Energy Summit&Expo KBR, Inc. SolydEra Group Ballard Power ..."
Alberto Capece su LinkedIn: Zelensky si prepara all'assedio,https://it.linkedin.com/posts/alberto-capece-09a42b36_zelensky-si-prepara-allassedio-activity-7122277187717652480-gAZy?trk=public_profile_share_view,"3 days ago ... Comincia il razionamento dell'elettricità. http://ilsimplicissimus2.com ... Il bilancio del terrore Usa: 4,5 milioni di morti. http://ilsimplicissimus2 ..."
Hydronews su LinkedIn: Il Comune di Brescia: “I treni a idrogeno del ...,https://it.linkedin.com/posts/hydronews_il-comune-di-brescia-i-treni-a-idrogeno-activity-7001829677187121152-TvD2?trk=public_profile_like_view,"Oct 16, 2023 ... Oltre 220 milioni di euro di investimenti e 30 MW di elettrolisi: il ... Idrogeno HESE - Hydrogen Energy Summit&Expo KBR, Inc. SolydEra Group Ballard Power ..."
Alberto Capece su LinkedIn: Zelensky si prepara all'assedio,https://it.linkedin.com/posts/alberto-capece-09a42b36_zelensky-si-prepara-allassedio-activity-7122277187717652480-gAZy?trk=public_profile_share_view,"3 days ago ... Comincia il razionamento dell'elettricità. http://ilsimplicissimus2.com ... Il bilancio del terrore Usa: 4,5 milioni di morti. http://ilsimplicissimus2 ..."
FAST Zero su LinkedIn: 5 motivi per creare una Comunità ...,https://it.linkedin.com/posts/fast-zero_5-motivi-per-creare-una-comunit%C3%A0-energetica-activity-7085942368209637376-vXN3?trk=public_profile_like_view,5 days ago ... Contributo a fondo perduto fino al 100% delle spese ammissibili per un importo massimo pari a 1.000.000 €. ... investimento nel futuro. Questi luoghi non sono ...
"Milano Finanza su LinkedIn: Rolls Royce, oltre l'idrogeno nei piani ...",https://it.linkedin.com/posts/milano-finanza_rolls-royce-oltre-lidrogeno-nei-piani-dell-activity-7076485638924976128-ZGCU?trk=public_profile_like_view,3 days ago ... ... miliardo». Nel dettaglio la Serie A incasserà il 50% degli eventuali ricavi ... investimento di lungo termine. Rete autostradale asset sul quale stiamo ...
YesWork App su LinkedIn: #inverno #bollette #gas #elettricità ...,https://it.linkedin.com/posts/yesworkapp_inverno-bollette-gas-activity-6985198871614263296-R828?trk=public_profile_like_view,"Oct 15, 2023 ... ... euro al mese! CAMBIA #LAMPADINE Le lampadine CFL costano un po' di più ... investimento. Anche abbassare la temperatura semplicemente di 2 gradi, può farti ..."
Daniele Invernizzi su LinkedIn: #combustibile #idrogeno #elettrici ...,https://it.linkedin.com/posts/danieleinvernizzi_combustibile-idrogeno-elettrici-activity-7119623004107530241-oJnx?trk=public_profile_like_view,"Oct 16, 2023 ... Il termine al 2026 che ci ha costretti a togliere le poche spese intelligenti, quelle su infrastrutture. La follia del treno all'idrogeno raccontata da questo ..."
Enemek Italia | LinkedIn,https://it.linkedin.com/company/enemek-italia?trk=public_post_feed-actor-name,"6 days ago ... ... elettricità-idrogeno-elettricità. Questo progetto ambizioso è sostenuto dai ... Idrogeno Rinnovabile per l'uso in processi industriali. In futuro, l'uso dell ..."
michele viglianisi su LinkedIn: La fonte di energia rinnovabile che ci ...,https://it.linkedin.com/posts/michele-viglianisi-01458b32_la-fonte-di-energia-rinnovabile-che-ci-porter%C3%A0-activity-6974665467009347584-adAf?trk=public_profile_like_view,"Oct 16, 2023 ... La fonte di energia rinnovabile che ci porterà oltre questo difficile momento è ... Si è conclusa ieri la terza edizione di #rethinktaranto, il bilancio può ..."
WTS GAS S.P.A. su LinkedIn: #parliamocichiaro ...,https://it.linkedin.com/posts/wts-gas-s.p.a._parliamocichiaro-parliamodiinnovazione-activity-7057032538111754240-GT7o?trk=public_profile_like_view,"Oct 14, 2023 ... L'alto potere calorifico del GPL permette di ridurre le spese fino al 40%, rispetto ad esempio al metano. Un risparmio concreto e costante che si traduce in ..."
Terna SpA | LinkedIn,https://br.linkedin.com/company/terna?trk=public_profile_experience-item_profile-section-card_subtitle-click,"6 days ago ... Il Piano prevede circa 1 miliardo di euro di investimenti nei prossimi 10 ... Un'anagrafe nazionale dei punti di produzione, #rinnovabile e non, che al momento ..."
PV Eurosolution | LinkedIn,https://www.linkedin.com/company/pv-eurosolution,"Oct 16, 2023 ... ... bilancio sostenibile. Questo investimento è a favore della sostenibilità ... rinnovabile – tanto quanto di quella finanziaria e sociale: è un progetto per la ..."
Emilio Odoardi ha pubblicato qualcosa su LinkedIn,https://it.linkedin.com/posts/emilio-odoardi-4a74b915a_h2iseo-trenord-expofer21-activity-6850402108324229120-uLqI?trk=public_profile_share_view,15 hours ago ... Attualmente la produzione dell'idrogeno verde da fonti rinnovabili costa 10/12 euro ... rinnovabile. Questo è gestire la transizione: fare i primi passi e ...
Lorenzo Carosso su LinkedIn: 80% FONDO PERDUTO!,https://www.linkedin.com/posts/lorenzo-carosso-b73a28134_80-fondo-perduto-activity-7088235383284494336-5Or0?trk=public_profile_like_view,"4 days ago ... Con SOLAR VALLEY entri a far parte di una Comunità energetica e puoi autoprodurre la tua energia in modo sostenibile Investimento responsabile, ..."
Enemek Italia su LinkedIn: Obiettivi Eolici: Italia tra i Paesi UE in ...,https://it.linkedin.com/posts/enemek-italia_obiettivi-eolici-italia-tra-i-paesi-ue-in-activity-7117516641369735168-XAX4,"6 days ago ... ... elettricità-idrogeno-elettricità. Questo progetto ambizioso è sostenuto dai ... Idrogeno Rinnovabile per l'uso in processi industriali. In futuro, l'uso dell ..."
Aiko Energy | LinkedIn,https://it.linkedin.com/company/aikoenergy?trk=public_profile_experience-item_profile-section-card_subtitle-click,6 days ago ... Fabbricazione di semiconduttori per il settore dell'energia rinnovabile ... Je maakt kans op een volledig verzorgd feest t.w.v. 5.000 euro! Daarnaast maak je ...
Dina Lanzi ha pubblicato qualcosa su LinkedIn,https://it.linkedin.com/posts/dina-lanzi-24180552_coronavirus-tutela-wearesnam-activity-6644545443382591488-wwSU?trk=public_profile_like_view,"8 days ago ... Snam, anche attraverso Fondazione Snam, ha deciso di stanziare 20 milioni di euro per realizzare iniziative in favore del sistema sanitario italiano e del ..."
Linde Gas Italia su LinkedIn: #idrogeno #mobilità,https://it.linkedin.com/posts/linde-gas-italia_idrogeno-mobilit%C3%A0-activity-7059901905883283459-is91?trk=public_profile_like_view,13 hours ago ... Dal 2025 ca 8.000 aziende saranno obbligate a presentare un Bilancio di ... BOC sta producendo idrogeno rinnovabile nel suo vicino sito di produzione ...
"Francesco Di Lieto su LinkedIn: Coal to hydrogen, Shanxi province ...",https://it.linkedin.com/posts/fdilieto_coal-to-hydrogen-shanxi-province-based-energy-activity-7076814078760951808-Dugg?trk=public_profile_share_view,"2 days ago ... ... idrogeno pulito utilizzando il gas dei forni dalla produzione di coke. ... milione di veicoli entro il 2035. #hydrogenplan #sustainabletransportation Yao, il cui ..."
INTERFLUID SRL su LinkedIn: #hydrogenexpo #idrogeno #h2 ...,https://it.linkedin.com/posts/interfluid-srl_hydrogenexpo-idrogeno-h2-activity-7060196909986045952-eCbI?trk=public_profile_like_view,4 days ago ... ... idrogeno! Ti aspettiamo: 17 - 19 Maggio Stand D132 - Hall 1 Link per ... This billion-dollar contract from MSC Cruises amounts to €3.5 billion for ...
Solarites S.r.l. | LinkedIn,https://www.linkedin.com/company/solarites,"2 days ago ... ... investimento, progettazione, costruzione e gestione di impianti da fonti di energia rinnovabile. ... Ieri siamo stati all'evento organizzato da Elettricità Futura ..."
Paolo Andrea Paparo ha pubblicato qualcosa su LinkedIn,https://it.linkedin.com/posts/paolo-andrea-paparo-073222152_trasporti-mobilit%C3%A0-taxi-activity-7081984142401224705-7RT7?trk=public_profile_share_view,6 days ago ... ... euro. È tempo di far crescere il mercato! Leggi l'Idea https://bit.ly ... idrogeno. I primi 14 treni alimentati completamente a idrogeno e prodotti da ...
Milano Finanza su LinkedIn: Il governo accelera sull'idrogeno: ecco ...,https://it.linkedin.com/posts/milano-finanza_il-governo-accelera-sullidrogeno-ecco-il-activity-7003226727648759808-6udS?trk=public_profile_like_view,"4 days ago ... L'investimento per il futuro dei giovani inizia a scuola! Al primo Salone #EduFin ... Unicredit: fallito l'iniziale test a 22,60-22,70 euro - MilanoFinanza News."
Giovanna Zacchi su LinkedIn: BPER Banca utilizza il 100% di ...,https://it.linkedin.com/posts/giovanna-zacchi-38982763_bper-banca-utilizza-il-100-di-energia-elettrica-activity-6528506377718104064-R46d?trk=public_profile_like_view,8 days ago ... BPER Banca utilizza il 100% di energia elettrica rinnovabile e il Gruppo BPER l ... euro per ogni studente. https://lnkd.in/ddWdsUeV ...
Gianluca Falduto su LinkedIn: Fincantieri accelera sull'idrogeno con ...,https://it.linkedin.com/posts/gianlucafalduto_fincantieri-accelera-sullidrogeno-con-msc-activity-7110809096525639680-j319,"Oct 13, 2023 ... Che strano, hanno iniziato a produrre navi da crociera ad idrogeno... Sono molto ignorante in questo settore, tuttavia non posso fare a meno di notare che ..."
Arena Digitale su LinkedIn: DIGITAL DAY,https://it.linkedin.com/posts/arena-digitale_digital-day-activity-7074008651308445696-8geQ?trk=public_profile_like_view,"1 day ago ... IDROGENO, STUDIO AGICI-FICHTNER: IN ITALIA FINANZIAMENTI PUBBLICI DA 1,14 MILIARDI DI EURO, +93% DI PROGETTI RISPETTO AL 2022 ... miliardo di dollari urly.it ..."
"Il Sole 24 Ore su LinkedIn: Idrogeno, l'altra via della mobilità ...",https://it.linkedin.com/posts/il-sole-24-ore_idrogeno-vs-elettrico-il-futuro-della-mobilit%C3%A0-activity-7119700690809044992-VIDc?trk=public_profile_like_view,"Oct 16, 2023 ... ... idrogeno che produce elettricità ed il gioco è fatto. Quindi a costo di non muovermi più aspetto utilizzando un bel motore diesel di ultima generazione l ..."
Luisa Martinelli ha pubblicato qualcosa su LinkedIn,https://it.linkedin.com/posts/luisa-martinelli-5b1a3b156_energia-renewable-idrogeno-activity-6986291981727498240-FZ9Z?trk=public_profile_like_view,"2 days ago ... ... elettricità fa passare il gas attraverso una struttura membranosa dove incontra l'aria ... idrogeno e investe 2,5 miliardi di euro nell'idrogeno verde. La ..."
Sindacato Nazionale Ingegneri (S.N.Ing.) su LinkedIn: Affitti troppo ...,https://it.linkedin.com/posts/sning_affitti-troppo-cari-al-nord-i-prof-rifiutano-activity-7102613475192938496-5pJO?trk=public_profile_like_view,2 days ago ... La #Regione #Puglia delibera l'acquisto di treni a idrogeno con i fondi del #PNRR: investimento complessivo di oltre 37 milioni di euro #sning ...
Francesco Di Lieto su LinkedIn: Wine o'clock: When Ningxia nectar ...,https://it.linkedin.com/posts/fdilieto_wine-oclock-when-ningxia-nectar-plays-culture-activity-7082278180828385280-PoWH?trk=public_profile_share_view,"2 days ago ... ... idrogeno pulito utilizzando il gas dei forni dalla produzione di coke. ... milione di veicoli entro il 2035. #hydrogenplan #sustainabletransportation Yao, il cui ..."
Michele Masulli su LinkedIn: #eolica #idroelettrica #energia #italia ...,https://it.linkedin.com/posts/michele-masulli_eolica-idroelettrica-energia-activity-7014656554209558528-OPL3?trk=public_profile_like_view,"13 hours ago ... Da azzerare da 3 a 6 anni: Si auspica non solo Catania ma: Palermo_Catania e Agrigento_Siracusa potrebbero generare "" ENERGIA ELETTRICA RINNOVABILE ... euro, ..."
Francesco Di Lieto su LinkedIn: Wine o'clock: When Ningxia nectar ...,https://it.linkedin.com/posts/fdilieto_wine-oclock-when-ningxia-nectar-plays-culture-activity-7082278180828385280-PoWH?trk=public_profile_share_view,"2 days ago ... ... idrogeno pulito utilizzando il gas dei forni dalla produzione di coke. ... milione di veicoli entro il 2035. #hydrogenplan #sustainabletransportation Yao, il cui ..."
Michele Masulli su LinkedIn: #eolica #idroelettrica #energia #italia ...,https://it.linkedin.com/posts/michele-masulli_eolica-idroelettrica-energia-activity-7014656554209558528-OPL3?trk=public_profile_like_view,"13 hours ago ... Da azzerare da 3 a 6 anni: Si auspica non solo Catania ma: Palermo_Catania e Agrigento_Siracusa potrebbero generare "" ENERGIA ELETTRICA RINNOVABILE ... euro, ..."
SENEC Italia | LinkedIn,https://it.linkedin.com/company/senec-italia,"2 days ago ... Energia rinnovabile e ambiente. Bari, BA ... I privati possono beneficiare di un Bonus fino a 1.500 euro, mentre i condomini possono ottenere fino a 8.000 euro."
Michele D'Elia su LinkedIn: Alstom completa la prima 'power car ...,https://it.linkedin.com/posts/michele-d-elia-44572977_alstom-completa-la-prima-power-car-destinata-activity-7083170177785245696-Texh?trk=public_profile_share_view,"Oct 16, 2023 ... ... IDROGENO ENTRO IL 2030 Stiamo parlando di rimpiazzare 70-80 mld di gas. La ... 700 euro per il carovita e 10 giorni al mese lavori dove vuoi e mezza giornata ..."
ATLANTICA DIGITAL SPA su LinkedIn: #abudhabi #simest ...,https://www.linkedin.com/posts/atlanticadigital_abudhabi-simest-smartmetering-activity-6902929858649837568-oosp?trk=public_profile_like_view,"3 days ago ... ... elettricità, gas e acqua, già leader di mercato in Italia e spina dorsale ... investimento negli Emirati Arabi Uniti è il segno forte della nostra ..."
Alberto Pavan su LinkedIn: Telecom: come si uccide un'azienda ...,https://it.linkedin.com/posts/alberto-pavan-14a252158_telecom-come-si-uccide-unazienda-strategica-activity-6891315344439664641-naXD,"6 days ago ... ... Idrogeno L'energia delle molecole ▷ Fonte energetica sostenibile, pulita e ... euro e 10,9 miliardi di kWh di elettricità. https://lnkd.in/dr5wYBeZ Naviga ..."
L'acqua per la produzione di idrogeno verde: opportunità o limite ...,https://it.linkedin.com/posts/sardegna-ricerche_lacqua-per-la-produzione-di-idrogeno-verde-activity-7079443272523218945-BqOH?trk=public_profile_like_view,"Oct 16, 2023 ... ACQUA PER LA PRODUZIONE DI IDROGENO VERDE: WEBINAR IL 14 LUGLIO Il 14 luglio si terrà su Zoom il webinar dal titolo ""L'acqua per la produzione di idrogeno…"
FuturEnergy Rinnovabile S.r.l. sta assumendo IMPIEGATO/A ...,https://it.linkedin.com/jobs/view/impiegato-a-commerciale-roma-at-futurenergy-rinnovabile-s-r-l-3741492100,"Oct 17, 2023 ... FUTURENERGY RINNOVABILE ... Alle figura professionale viene concessa la possibilità di un'assunzione a tempo indeterminato, auto aziendale, rimborso spese, ..."
Andrea Camporese su LinkedIn: EnerMAC ha aquisito una nuova ...,https://it.linkedin.com/posts/andrea-camporese-02b89626_enermac-ha-aquisito-una-nuova-commessa-confermando-activity-7117138878859218947-nviz?trk=public_profile_like_view,"Oct 13, 2023 ... Ho vissuto in prima persona, per il lavoro che faccio, la tariffa Onnicomprensiva per produzione di E.E. da fonte rinnovabile che regala 280€/MWh a biomasse, ..."
"Rinnovabili.it su LinkedIn: Tessuto piezoelettrico, trasforma i ...",https://it.linkedin.com/posts/rinnovabili-it_tessuto-piezoelettrico-trasforma-i-movimenti-activity-6963041388359749632-Rhgw?trk=public_profile_like_view,6 days ago ... ... elettricità. Lo hanno creato gli scienziati della Nanyang Technological ... euro al MWh. E mentre la volatilità dei prezzi riaccende nuovi timori sulle ...
"Il Passaggio alla Casa Green: Costi, Ricavi e Benefici",https://it.linkedin.com/pulse/il-passaggio-alla-casa-green-costi-ricavi-e-benefici,"Oct 17, 2023 ... Installando pannelli solari o altre fonti di energia rinnovabile, è possibile produrre energia elettrica in eccesso, che può essere immagazzinata o venduta alla ..."
ZeroEmission News su LinkedIn: Nexta Capital acquisisce da R ...,https://it.linkedin.com/posts/zeroemission-news_nexta-capital-acquisisce-da-rpower-un-portafoglio-activity-7121109796681846784--TZ7,"4 days ago ... ... rinnovabile, ha siglato contratti “chiavi in mano” per un valore totale di circa 2,7 milioni di euro da concludersi entro il 2023."
Massimiliano Salvi on LinkedIn: Cappotti termici che vanno a fuoco ...,https://www.linkedin.com/posts/massimiliano-salvi-51321b23_cappotti-termici-che-vanno-a-fuoco-ora-activity-7118903727595413504-VbYR,"2 days ago ... More Relevant Posts · Autostrade, Scannapieco chiude la porta alla scalata di Dogliani: per Cdp investimento di lungo termine - MilanoFinanza News · Motori diesel ..."
Maurizio Quaglietti su LinkedIn: TERNI - CITTÀ PER L'INDUSTRIA E ...,https://it.linkedin.com/posts/maurizio-quaglietti-aa639b201_terni-citt%C3%A0-per-lindustria-e-lelettricit%C3%A0-activity-7001070782021791744-Sxxu?trk=public_profile_like_view,"Oct 18, 2023 ... TERNI - CITTÀ PER L'INDUSTRIA E L'ELETTRICITÀ Per la “Società delle Fucine”, una ... miliardo e cento milioni di lire. Ma per Terni la pressa da dodicimila ..."
"Terna SpA su LinkedIn: Terna, al via il procedimento autorizzativo ...",https://www.linkedin.com/posts/terna_terna-al-via-il-procedimento-autorizzativo-activity-6906577057623498752-9wCL?trk=public_profile_like_view,"Oct 15, 2023 ... ... euro, serviranno a velocizzare i ... Un'anagrafe nazionale dei punti di produzione, #rinnovabile e non, che al momento superano il milione e duecentomila unità."
Gi Group sta assumendo UFFICIO TECNICO settore GPL in Roma ...,https://it.linkedin.com/jobs/view/ufficio-tecnico-settore-gpl-at-gi-group-3748933157,1 day ago ... UFFICIO TECNICO settore GPL. Gi Group Roma. Adesso Sii tra i primi 25 candidati ... buoni pasto da 7€. Si prevedono brevi trasferte sul territorio Nazionale.
Linde Gas Italia su LinkedIn: #aipo,https://www.linkedin.com/posts/linde-gas-italia_aipo-activity-7076567585881751552-FlP-?trk=public_profile_like_view,8 days ago ... Dal 2025 ca 8.000 aziende saranno obbligate a presentare un Bilancio di ... BOC sta producendo idrogeno rinnovabile nel suo vicino sito di produzione ...
"Giovanni Giustiniani su LinkedIn: ""Alcune volte vinci, tutte le altre ...",https://www.linkedin.com/posts/giovanni-giustiniani-74b42022_alcune-volte-vinci-tutte-le-altre-volte-activity-6780022972234182656-2r0w?trk=public_profile_like_view,"4 days ago ... ... Elettricità Futura. 2 anni. Segnala post; Chiudi menu. ""Alcune volte vinci, tutte ... L'#investimento previsto è di 152 milioni di reais e la produzione dovrebbe ..."
Hydrogen-news.it su LinkedIn: IIT Hydrogen Bolzano e NanoSUN ...,https://it.linkedin.com/posts/hydrogen-news-it_iit-hydrogen-bolzano-e-nanosun-portano-le-activity-7118261558853447680-W96n?trk=public_profile_like_view,6 days ago ... Concentrarsi sulla mobilità avendo un'infrastruttura flessibile e di semplice gestione con investimento contenuto ... Siemens Energy avvia in Francia la prima ...
Imma Caruso su LinkedIn: intelligenza artificiale hr,https://it.linkedin.com/posts/imma-caruso-a4586921_intelligenza-artificiale-hr-activity-7117988082829684736-yyf5?trk=public_profile_like_view,"5 days ago ... Il settore occupa 1 milione e 160 mila persone e genera un valore di 92,7 ... Dai fleet manager ai progettisti per treni a idrogeno: ecco come cambierà la ..."
