title,link,snippet
Moratoria energia rinnovabile: proposta di legge dei comitati | Regione,https://www.cagliaripad.it/600077/moratoria-energia-rinnovabile-proposta-di-legge-dei-comitati/,"Oct 9, 2023 ... Una dettagliata proposta di legge con richiesta di moratoria dei mega impianti di energia rinnovabile pronta per essere approvata."
"Pianificazione urbana, energia rinnovabile e agribio contro la ...",https://ilmanifesto.it/pianificazione-urbana-energia-rinnovabile-e-agribio-contro-la-speculazione-in-campania,"3 days ago ... Pianificazione urbana, energia rinnovabile e agribio contro la speculazione in Campania ... legge che affronti in modo coordinato cambiamento climatico e governo ..."
Faq — Energia,https://energia.regione.emilia-romagna.it/comunita-energetiche/faq,"Oct 2, 2023 ... ... legge regionale n. 5/2022 ""Promozione e sostegno delle comunità energetiche ... energia rinnovabile (ARERA). Ad oggi risulta approvato solo il provvedimento ..."
Reddito di energia: primo passo della legge per aiutare le famiglie ...,https://www.ilcentro.it/pescara/reddito-di-energia-primo-passo-della-legge-per-aiutare-le-famiglie-1.3198275,"Oct 4, 2023 ... Reddito di energia: primo passo della legge per aiutare le famiglie. Pannelli ... rinnovabile – l'energia non consumata verrebbe poi immessa in rete ..."
"L'Unione europea alza le ambizioni sulle rinnovabili, il target del 42 ...",https://www.eunews.it/2023/10/09/rinnovabili-ue-clima-green-deal/,"Oct 9, 2023 ... Strasburgo conferma l'accordo Ue per aumentare gli obiettivi di energia rinnovabile al 2030. Economia. Strasburgo conferma l'accordo Ue per aumentare gli ..."
"Moratoria su rinnovabili, proposta legge comitati in Consiglio ...",https://www.ansa.it/sardegna/notizie/2023/10/09/moratoria-su-rinnovabili-proposta-legge-comitati-in-consiglio_a965ecc9-be19-4962-a9aa-7429bd6e3b71.html,"Oct 9, 2023 ... ... legge con richiesta di moratoria pronta per... (ANSA) ... Energia rinnovabile · Energie alternative · Codici · Marco Pau … Ultima ora. 18:59 ..."
Il Consiglio dell'UE ha adottato ufficialmente la Direttiva RED III: i ...,https://hydronews.it/il-consiglio-dellue-ha-adottato-ufficialmente-la-direttiva-red-iii-i-target-vincolanti-sullidrogeno-diventano-legge-europea/,"Oct 9, 2023 ... Il Consiglio dell'UE ha adottato ufficialmente la Direttiva RED III: i target vincolanti sull'idrogeno diventano 'legge' europea ... energia rinnovabile. Quota ..."
"Dl Energia, lunedì arriva in Cdm: nella bozza c'è la proroga del ...",https://tg24.sky.it/economia/2023/10/21/dl-energia-bozza-proroga-mercato-tutelato,"7 days ago ... Nella bozza del decreto-legge presenti anche aiuti alle imprese energivore, all'eolico e alle regioni che ospiteranno impianti da fonti di energia rinnovabile."
Nuovi impianti di energia rinnovabile lasciano spazio anche ai ...,https://www.linkiesta.it/2023/10/agrivoltaico-energie-rinnovabili-agricoltura-api-impollinatori/,"Oct 2, 2023 ... La carica delle cento arnieNuovi impianti di energia rinnovabile lasciano spazio anche ai terreni agricoli · L'agrivoltaico è il tentativo di unire le fonti ..."
"Transizione ecologica, Regione apripista: Comunità energetica ...",https://www.regione.emilia-romagna.it/notizie/2023/ottobre/transizione-ecologica-regione-apripista-cer-bo,"Oct 5, 2023 ... 5 del 27 maggio 2022, 'Promozione e sostegno delle comunità energetiche rinnovabili e degli autoconsumatori di energia rinnovabile che agiscono collettivamente' ..."
AUDIZIONE A.C. 1437 Conversione in legge del decreto-legge 29 ...,https://documenti.camera.it/leg19/documentiAcquisiti/COM10/Audizioni/leg19.com10.Audizioni.Memoria.PUBBLICO.ideGes.20191.13-10-2023-15-57-18.210.pdf,"Oct 13, 2023 ... REGIME DI AGEVOLAZIONI A FAVORE DELLE IMPRESE A FORTE CONSUMO DI ENERGIA ELETTRICA. 1. CONFIGURAZIONI DI AUTOCONSUMO E COMUNITÀ DI ENERGIA RINNOVABILE. 2."
"Transizione ecologica, Regione apripista: Comunità energetica ...",https://www.regione.emilia-romagna.it/notizie/2023/ottobre/transizione-ecologica-regione-apripista-cer-bo,"Oct 5, 2023 ... 5 del 27 maggio 2022, 'Promozione e sostegno delle comunità energetiche rinnovabili e degli autoconsumatori di energia rinnovabile che agiscono collettivamente' ..."
"Ambiente, energia rinnovabile non sufficiente per il trasporto ...",https://www.altramantova.it/it/scienze/ambiente/37405-ambiente-energia-rinnovabile-non-sufficiente-per-il-trasporto-pubblico-sostenibile.html,"Oct 15, 2023 ... ... energia rinnovabile, che influisce sulle emissioni di carbonio. Ad esempio, si legge nel report, l'energia fornita a un veicolo a gas naturale ha ..."
Dettaglio Deliberazione della Giunta Regionale,https://bur.regione.veneto.it/BurvServices/pubblica/DettaglioDgr.aspx?id=515167,"1 day ago ... Energia (ora U.O. Infrastrutture Energetiche e Autorizzazioni), in data 21 luglio 2022, ha dato avvio al procedimento, ai sensi dell'art. 7 della Legge 7 agosto ..."
News - Next Green Planet,https://nextgreenplanet.it/news/,"Oct 2, 2023 ... Le eccellenze italiane si incontrano per parlare di come affrontare le sfide dei prossimi anni su energia rinnovabile. « Post precedenti. Cerere."
Gruppo di autoconsumo collettivo: cos'è | Valore Solare,https://www.valoresolare.it/gruppo-di-autoconsumo-collettivo-condivisione-dell-energia/,"Oct 12, 2023 ... Un gruppo di consumatori è formato da almeno due autoconsumatori di energia rinnovabile, i quali hanno stipulato un accordo privato per la condivisione dell' ..."
Bruxelles finalizza il “pacchetto sull'energia eolica” per aiutare l ...,https://euractiv.it/section/energia-e-ambiente/news/bruxelles-finalizza-il-pacchetto-sullenergia-eolica-per-aiutare-lindustria-ue-in-difficolta/,"8 days ago ... ... energia eolica e di altre fonti di energia rinnovabile“. Parallelamente, la ... legge sulle energie rinnovabili, in particolare per quanto riguarda le ..."
Come intervenire sulla decarbonizzazione di auto e case e sulla ...,https://asvis.it/goal7/notizie/379-17855/come-intervenire-sulla-decarbonizzazione-di-auto-e-case-e-sulla-siccita,"Oct 2, 2023 ... ... rinnovabile sarebbe pari a più di metà del potenziale di produzione di energia rinnovabile. ... energia da fonti rinnovabili – si legge ancora nel Rapporto -. Lo ..."
Pubblica Amministrazione,https://www.enea.it/it/servizi/pubblica-amministrazione.html,"Oct 10, 2023 ... ... energia primaria non rinnovabile, conseguito con alcuni interventi di riqualificazione energetica (ex legge 296/2006). ... energia e dell'ambiente promosse da ..."
Nuovo Piano Energetico della Regione Friuli-Venezia Giulia: al via ...,https://www.efficienzaenergetica.enea.it/vi-segnaliamo/nuovo-piano-energetico-della-regione-friuli-venezia-giulia-al-via-gli-incontri-per-coinvolgere-cittadini-imprese-e-pa.html,"Oct 11, 2023 ... ... energia rinnovabile. Partendo dal presupposto che la transizione verso un ... legge FVGreen, in cui si impegna a diventare una Regione a neutralità climatica ..."
Shell completa l'acquisizione della società di gestione dell'energia ...,https://www.shell.it/media-centre/2023/shell-completa-l-acquisizione-della-societa-di-gestione-dellenergia-ego-srl.html,"Oct 9, 2023 ... EGO gestisce 1,6 GW di energia rinnovabile e da co-generazione, aggregandola ... legge per reagire ai cambiamenti climatici; (k) le condizioni del mercato ..."
"Biomasse legnose, fonte di energia rinnovabile da valorizzare",https://www.rinnovabili.it/energia/biomassa/biomasse-legnose-una-fonte-di-energia-rinnovabile-da-valorizzare-nel-mix-energetico-nazionale/,"Oct 3, 2023 ... Biomasse legnose, una fonte di energia rinnovabile da valorizzare nel mix energetico nazionale ... Ogni abuso sarà perseguito a norma di legge. © 2010 ..."
Anche a Montesilvano l'amministrazione comunale si prepara a ...,https://www.ilpescara.it/cronaca/montesilvano/comunitra-energetica-rinnovabile.html,"Oct 19, 2023 ... ... energia rinnovabile. Nell'atto di giunta, si legge che il Comune intende "" promuovere una fase conoscitiva pubblica tesa a valutare l'interesse delle utenze ..."
In questa colonnina ricaricare con energia rinnovabile costa meno ...,https://www.tomshw.it/automotive/in-questa-colonnina-ricaricare-con-energia-rinnovabile-costa-meno,"Oct 2, 2023 ... Oltre la Legge di Moore, Nvidia ha la ""Legge di Huang""... In questa colonnina ricaricare con energia rinnovabile costa meno. L'energia rinnovabile è quella ..."
Quotidiano Energia,https://www.quotidianoenergia.it/,"1 day ago ... ... legge 48/23. … La determina Arera. Fine tutela, forse il Pnrr eviterà la ... energia rinnovabile complessiva previsto dal Pniec al 2030” … La sintesi del ..."
Le Comunità Energetiche Rinnovabili (CER) e i gruppi di ...,https://www.beghelli.it/it/news/le-comunit%C3%A0-energetiche-rinnovabili-cer-e-i-gruppi-di-autoconsumo-collettivo-ac-quando-l-unione-fa-la-forza-227874,"Oct 9, 2023 ... Il Decreto Legge 162/2019 (il cosiddetto decreto Milleproroghe, convertito in Legge n. ... energia rinnovabile si uniscono per produrre e consumare energia. Un ..."
ALBO UFFICIO ON-LINE STORICO - 2023 | Regione Siciliana,https://www.regione.sicilia.it/istituzioni/regione/strutture-regionali/genio-civile-siracusa/albo-ufficio-line-storico-2023,"Oct 4, 2023 ... 34 di conversione in legge, con modificazioni, del Decreto Legge 01.03.2022, n.17 - (il cosiddetto ""Decreto Energia""), per la realizzazione di un impianto ..."
Sportello energia | Comune di Bologna,https://www.comune.bologna.it/servizi-informazioni/sportello-energia-informazioni,"Oct 18, 2023 ... scegliere un contratto di fornitura con energia verde (100% energia rinnovabile); ... Decreto legge 29 settembre 2023, n. 131 - ""Misure urgenti in materia di ..."
Provvedimenti dirigenti amministrativi | Comune di Abbasanta,https://www.comune.abbasanta.or.it/index.php/ente/trasparenza/procedure/10056/provv_dirigenti?rf=1&cl=1&or=asc,"Oct 10, 2023 ... ... LEGGE N. 234 ... LAVORI DI POTENZIAMENTO ED EFFICIENTAMENTO IMPIANTI DI PRODUZIONE DI ENERGIA ELETTRICA DA FONTE RINNOVABILE INSTALLATI NEGLI EDIFICI COMUNALI."
"Bonus edilizi, l'Umbria verso una legge per sbloccare i crediti fiscali ...",https://www.qualenergia.it/articoli/bonus-edilizi-umbria-verso-legge-sbloccare-crediti-fiscali/,"Oct 10, 2023 ... Infodata energia. Quota Rinnovabili = 33,3%. Energia rinnovabile su domanda elettricità in Italia. giovedì 19 ottobre 2023. ULTIMO MESE: Agosto 2023. DATI ..."
Comunicati - Consiglio Regionale della Valle d'Aosta,https://www.consiglio.vda.it/app/comunicatigruppi,"Oct 11, 2023 ... Rassemblement Valdôtain. Conferenza stampa di presentazione della proposta di legge ... Le Comunità di energia rinnovabile non sono un progetto di CVA. «« « 1 di ..."
INSERIRE TITOLO CENTRATO MAIUSCOLO,http://oli.consiglio.regione.toscana.it/wp-content/uploads/antonellameucci/ebcb677a4ed42e72177949ea087fd36d.pdf,"Oct 6, 2023 ... produzione di energia rinnovabile. risorse di fonti energetiche rinnovabili ... sono individuate per legge dalle Regioni (art. 20, comma 4) conformemente ai."
REGIONE LAZIO,https://www.regione.lazio.it/sites/default/files/documentazione/AMB-DD-G13426-11-10-2023.pdf,"Oct 11, 2023 ... Questa misura deve sostenere la produzione di idrogeno elettrolitico a partire da fonti di energia rinnovabile ai sensi della direttiva (UE) 2018/2001 o ... legge ..."
Incertezza nel gas(bio) > Nextville,https://www.nextville.it/news/52672/incertezza-nel-gasbio/,"Oct 16, 2023 ... I fanghi di depurazione ed energia rinnovabile. Vito Palumbo, Responsabile ... Riferimenti. Legge 26 luglio 2023, n. 95. Misure urgenti per il settore energetico ..."
Fincalabra,https://www.fincalabra.it/,"Oct 20, 2023 ... Avviso pubblico “Energia rinnovabile microimprese”... Scadenza: Venerdì, 03 ... LR 48 del 21.12.2018 recante “Legge di stabilità regionale 2019” Fincalabra, a ..."
"Legge regionale n.12 del 2023 » Demetra – Normativa, atti e sedute ...",https://demetra.regione.emilia-romagna.it/al/articolo?urn=er:assemblealegislativa:legge:2023;12,"Oct 3, 2023 ... 5 (Promozione e sostegno delle comunità energetiche rinnovabili e degli autoconsumatori di energia rinnovabile che agiscono collettivamente);. o) legge ..."
"DL Sicurezza energetica, salta fine tutela, aggiunta norma su ...",https://www.pv-magazine.it/2023/10/23/dl-sicurezza-energetica-salta-fine-tutela-aggiunta-norma-su-contributo-produttori-al-gse-per-ridistrubuzione-locale/,5 days ago ... ... energia rinnovabile ... La seconda bozza del Decreto Legge Sicurezza energetica è in discussione al Consiglio dei ministri.
Regione Emilia-Romagna: al via il percorso di formazione della ...,https://www.art-er.it/2023/10/regione-emilia-romagna-al-via-il-percorso-di-formazione-della-comunita-energetica-rinnovabile/,"Oct 17, 2023 ... ... Rinnovabile, promosso dalla Regione Emilia-Romagna affiancata dal supporto ... legge regionale sulle CER, per la promozione e la diffusione concreta delle ..."
Energia: considerazioni su biocarburanti e E-fuel | Federforeste ...,https://www.federforeste.it/news/energia-considerazioni-su-biocarburanti-e-e-fuel/,"Oct 18, 2023 ... L'energia elettrica rinnovabile: • può essere fornita da un impianto ... È stata pubblicata in gazzetta ufficiale (serie generale 236 del 9 ottobre 2023) la legge ..."
Contributi ai Comuni per la progettazione e la ... - Energia FVG,https://energia.regione.fvg.it/notizie/article/Contributi-ai-Comuni-per-la-progettazione-e-la-realizzazione-di-parchi-tematici/,"Oct 18, 2023 ... Con legge regionale 22/2022, articolo 4, commi 1-4, l'Amministrazione ... Autorizzazioni regionali per impianti alimentati da fonte rinnovabile · Piano ..."
PRESIDENZA DEL CONSIGLIO DEI MINISTRI - COMMISSARIO ...,https://www.gazzettaufficiale.it/eli/id/2023/10/10/23A05490/SG,"Oct 10, 2023 ... ... legge del 31 maggio 2021, n. 77, convertito con modificazioni dalla ... energia o di teleriscaldamento in caso di impianti di generazione di energia termica."
"Comunità energetiche rinnovabili, approvata la proposta elaborata ...",https://www.comune.cesena.fc.it/flex/cm/pages/ServeBLOB.php/L/IT/IDPagina/53440,"Oct 19, 2023 ... ... Legge n. 5 ... Una Comunità Energetica Rinnovabile è un gruppo formale di consumatori di energia da fonte rinnovabile, alcuni dei quali sono anche produttori."
"Rinnovabili, ok del Consiglio UE a nuova direttiva: obiettivo minimo ...",https://finanza.lastampa.it/News/2023/10/09/rinnovabili-ok-del-consiglio-ue-a-nuova-direttiva-obiettivo-minimo-a-42-5percento-entro-il-2030/MTUxXzIwMjMtMTAtMDlfVExC,"Oct 9, 2023 ... Il Consiglio UE ha adottato la nuova direttiva sulle energie rinnovabili per aumentare la quota di energia rinnovabile nel consumo complessivo di ... legge in ..."
SITE S.p.A.- Ispirati dal Progresso,https://www.sitespa.it/,"Oct 11, 2023 ... Soluzioni per un'energia rinnovabile. COGENERAZIONE DA BIOMASSA. Scopri ... legge. CODICE ETICO. Visualizza PDF. BILANCIO DI SOSTENIBILITÀ. Visualizza PDF ..."
"Energia eolica, ecco cosa prevede il piano dell'Europa entro il 2030 ...",https://www.lastampa.it/economia/2023/10/24/news/energia_eolica_piano_europeo_2030-13806310/,"4 days ago ... ... legge in una nota dell'Esecutivo Ue –. Sebbene il settore dell'energia ... rinnovabile offshore entro il 2050, con obiettivi intermedi per il 2030 e il 2040 ..."
La normativa Red 3 è legge: obiettivo 45% di rinnovabili nel ...,https://www.ecodallecitta.it/consiglio-europeo-adotta-la-normativa-red-3-obiettivo-45-di-rinnovabili-nel-consumo-totale-entro-2030/,"Oct 11, 2023 ... La normativa Red 3 è legge: obiettivo 45% di rinnovabili nel consumo totale entro 2030 ... – Una quota vincolante pari ad almeno il 29% di energia rinnovabile nel ..."
Notizia | Partnership tra A2A e Enfinity Global per l'energia ... - Utilitalia,https://www.utilitalia.it/notizia/536cea61-6b43-4f48-b11c-d06511cba8fc,"4 days ago ... ... energia. Lo si legge in una nota in cui viene spiegato che l'accordo ... Grazie all'accordo, Enfinity Global diventa il primo fornitore di capacità rinnovabile ..."
Archivio Notizie PNRR | Ministero dell'Ambiente e della Sicurezza ...,https://www.mase.gov.it/archivio-notizie-pnrr,"Oct 19, 2023 ... 13 legge 8 luglio 1986, n. 349) · Autorità NIS · Mobility ... Pichetto: ""Creiamo le condizioni per incrementare l'energia rinnovabile di cui l'Italia ha bisogno""."
Tornano a farsi sentire i partigiani del clima. Ma il Friday for future ...,https://www.lanazione.it/firenze/cronaca/tornano-a-farsi-sentire-i-partigiani-del-clima-ma-il-friday-for-future-non-e-oceanico-9ea42369,"Oct 6, 2023 ... ""La nostra rabbia è energia rinnovabile"", si legge sullo striscione in cima al corteo.: ""E'dal 2019 che cerchiamo di far pressione sul tema ambientale."
Approvato emendamento sugli incentivi al Biometano: una svolta ...,https://www.ruminantia.it/approvato-emendamento-sugli-incentivi-al-biometano-una-svolta-per-lenergia-sostenibile-in-italia/,"Sep 30, 2023 ... Questa misura, inclusa nel contesto della legge di conversione del D.L. Asset ... energia rinnovabile. L'emendamento, che allinea il supporto finanziario ..."
Offerta energia per famiglie - Family Energia Monoraria - Dolomiti ...,https://www.dolomitienergia.it/offerte-casa/luce/family-energia-monoraria.html,"1 day ago ... Offerta esclusiva per nuovi clienti che aderiscono via web. 100% ENERGIA RINNOVABILE CERTIFICATA, 0% PENSIERI. Corrispettivo Energia fisso monorario per stare ..."
Mobilità | Alternativa Sostenibile News su agricoltura sostenibile ...,https://www.alternativasostenibile.it/categorie-news/mobilit%C3%A0,"4 days ago ... Energia, bonus colonnine. Leggi. 12/10/2023 - 12:06. Energia: parte il “bonus ... Mobilità: auto in città a 30 km/h,... Con il disegno di legge sulla sicurezza ..."
Le nostre tariffe Green sono anche competitive! | Energia Positiva,https://www.energia-positiva.it/le-nostre-tariffe/,"Oct 6, 2023 ... Nata come una struttura focalizzata principalmente sulla produzione di energia 100% rinnovabile, la cooperativa è recentemente entrata anche nel mercato della ..."
XIX Legislatura - Deputati e Organi - Scheda deputato - PICHETTO ...,https://www.camera.it/leg19/29?tipoAttivita=governo&tipoVisAtt=3&shadow_deputato=303089&lettera=&idLegislatura=19&tipoPersona=Governo_202_706_3,"Oct 20, 2023 ... ""Conversione in legge del decreto-legge 10 agosto 2023, n. 104, recante ... energia rinnovabile da produrre entro il 2030 n. 3-00581 Pastorino (Risposta ..."
impianti fotovoltaici - Conversazione nella community sull'energia ...,https://www.altroconsumo.it/community/energia-rinnovabile/produrre-energia-elettrica/conversazione/11305/impianti-fotovoltaici,"Oct 5, 2023 ... ... legge non lo si puo usare anche se ... Condividi la tua opinione o fai la tua domanda nel gruppo Produrre energia elettrica della comunità Energia rinnovabile!"
Transizione ecologica. Comunità energetiche rinnovabili: la ...,https://notizie.regione.emilia-romagna.it/comunicati/2023/ottobre/transizione-ecologica-comunita-energetiche-rinnovabili-la-regione-fa-da-apripista-e-avvia-la-realizzazione-della-2018sua2019-cer-nel-cuore-del-fiera-district-a-bologna-coinvolti-i-soggetti-pubblici-e-privati-che-gravitano-nell2019area-calvano-201cun,"Oct 3, 2023 ... Bologna - Parte, nel cuore del Fiera District a Bologna, la Comunità energetica rinnovabile della Regione Emilia-Romagna. ... energia da fonti pulite e ..."
Energie rinnovabili in Italia: una panoramica,https://www.otovo.it/blog/energie-rinnovabili-in-italia/,"Oct 20, 2023 ... All'interno del documento si legge che la crescita della domanda elettrica ... La fonte di energia rinnovabile che garantisce il principale contributo alla ..."
"Clima, Europa, Energia, Treno a idrogeno e amianto: Scopri le 5 ...",https://www.ohga.it/clima-europa-energia-treno-a-idrogeno-e-amianto-scopri-le-5-buone-notizie-della-settimana/,"Oct 12, 2023 ... “Una legge sul clima” Wwf, Greenpeace e Legambiente presentano una legge al Senato ... rinnovabile che prevede una copertura europea pari al 42.5-45% entro ..."
Che cos'è una comunità energetica rinnovabile (CER)? | Sorgenia,https://www.sorgenia.it/faq/che-cose-una-comunita-energetica-rinnovabile-cer,4 days ago ... ... legge il contatore? Cosa succede se sostituisco il mio contatore? Espandi I ... Negli ultimi anni il settore dell'energia rinnovabile ha visto la diffusione ...
Bonus famiglia 2023: la guida aggiornata — idealista/news,https://www.idealista.it/news/finanza/economia/2023/10/24/176059-bonus-famiglia-2023-la-guida-aggiornata,"4 days ago ... L'obiettivo di questo fondo è agevolare l'accesso all'energia rinnovabile per famiglie con un ISEE inferiore a 15.000 euro o, nel caso di nuclei familiari con ..."
"Fine mercato tutelato energia, verso proroga 6 mesi: bozza decreto ...",https://www.radioromacapitale.it/articolo/fine-mercato-tutelato-energia-verso-proroga-6-mesi-bozza-decreto/,"7 days ago ... ... legge nella bozza del provvedimento – assicura, con propri provvedimenti ... rinnovabile nei settori energivori a rischio delocalizzazione attraverso la ..."
"Offerte Luce Energia Verde, le migliori Tariffe Green Oggi",https://luce-gas.it/confronto/offerte-energia-verde,"Oct 3, 2023 ... Come viene certificata l'energia rinnovabile con le Garanzie d'Origine (GO)? ... legge. Negli ultimi anni la sensibilità nei confronti dell'energia verde appare ..."
Comunicato stampa del Consiglio dei Ministri n. 54 | www.governo.it,https://www.governo.it/en/node/23937,"Oct 16, 2023 ... ... energia e il bonus sociale elettricità (200 milioni di euro) per sostenere le ... la legge della Regione Veneto n. 22 del 06/09/2023, recante “Modifiche alla ..."
Energia da fonti rinnovabili: dal Mase la garanzia di origine,https://www.ambientesicurezzaweb.it/energia-da-fonti-rinnovabili-la-garanzia-di-origine/,"Oct 10, 2023 ... ... energia rinnovabile in energia elettrica. Esso comprende in particolare: le ... legge 1 marzo 2022, n. 17, convertito con modificazioni dalla legge 27 aprile ..."
Direttiva Red III energie rinnovabili: obiettivo 42.5% entro il 2030 ...,https://www.ingenio-web.it/articoli/direttiva-red-iii-energie-rinnovabili-ok-definitivo-del-consiglio-europeo-obiettivo-42-5-entro-il-2030/,"Oct 11, 2023 ... ... energia rinnovabile sul consumo energetico totale dell'UE entro il 2030. La ... Superbonus 'tartassato' dalla Legge di Bilancio: aumento tasse sulle plusvalenze ..."
"APE, Aziende per l'Energia - CNA Padova",https://cnapadova.it/servizi/ape-aziende-per-lenergia/,4 days ago ... Le imprese che optano per APE energia elettrica rinnovabile possono ... legge il DL “Sostegni” 41/21 ha previsto l'esenzione totale (anziché la riduzione del ...
Nuove norme sulle rinnovabili: quota 45% entro il 2030 - la ...,https://www.repubblica.it/economia/rapporti/energitalia/trasformazione/2023/10/10/news/nuove_norme_sulle_rinnovabili_quota_45_entro_il_2030-417454784/,"Oct 10, 2023 ... ... legge in unta nota del Consiglio Ue. ... Gli Stati membri progetteranno aree di accelerazione delle energie rinnovabili in cui i progetti di energia rinnovabile ..."
Industria - Regione Autonoma Friuli Venezia Giulia,https://www.regione.fvg.it/rafvg/cms/RAFVG/economia-imprese/industria/,"Oct 18, 2023 ... ... Legge regionale 3/2015 ""Rilancimpresa"", articolo 22 bis – DPReg. 115/2021 ... energia. PR FESR 2021-2027 - Finanziamenti per l'utilizzo delle energie ..."
Ecomondo 2023 - Energie circolari 2.0: Materia ed energia per la ...,https://rivistarifiuti.reteambiente.it/ecomondo2023-energie-circolari,"Oct 16, 2023 ... I fanghi di depurazione ed energia rinnovabile. Vito Palumbo, Responsabile ... legge. È diritto dell'interessato ottenerne controllo, aggiornamento, modifica ..."
PwC Alumni Italia Archivio News,https://alumni.pwc.it/news/archive,"Oct 11, 2023 ... ... energia e si applica agli impianti di energia rinnovabile esclusi dal ritiro dedicato e dallo scambio sul posto. Questa normativa è simile a un'altra legge ..."
Fondo per il sostegno alla Transizione Industriale,https://www.invitalia.it/-/media/invitalia/documenti/sosteniamo-grandi-investimenti/fondo-transizione-industriale/presentazione-fti.pdf,"Oct 10, 2023 ... 19, comma 2, della legge 20 novembre 2017, n. ... 41 GBER “Aiuti agli investimenti per la promozione di energia da fonti rinnovabili, idrogeno rinnovabile e ..."
Saggi - Fondazione Terzjus ETS,http://terzjus.it/articoli/saggi/,7 days ago ... Comunità Energetica Rinnovabile | Energia | Parlamento europeo · Articoli ... La Legge regionale del Piemonte n. 25 del 20 dicembre 2022 - nel disciplinare ...
"Misure urgenti in materia di energia, interventi per sostenere il ...",https://www.senato.it/service/PDF/PDFServer/BGT/01389821.pdf,"Oct 6, 2023 ... dall'articolo 1, comma 13, della legge di bilancio 2023 (legge n. 197 del 2022) ... resti soggetto alle istruzioni dell'autoconsumatore di energia rinnovabile."
Fotovoltaico nelle cave per decarbonizzare gli “hard to abate”,https://www.esg360.it/energy-transformation/energia-solare-nelle-cave-dismesse-per-decarbonizzare-i-settori-hard-to-abate/,"Oct 19, 2023 ... L'energia rinnovabile, in particolare il fotovoltaico, è una delle leve principali per accelerare il passo verso la transizione energetica. Tuttavia, la ..."
A scuola con energia! per avvicinare i più piccoli ai temi dell ...,https://www.minori.gov.it/it/notizia/scuola-con-energia-avvicinare-i-piu-piccoli-ai-temi-dellambiente,"Oct 6, 2023 ... ... energia rinnovabile: è questo l'obiettivo del progetto A scuola con energia! ... legge nel comunicato stampa diffuso da Renantis -, quelli che apprendono con ..."
Servizio di tutela della vulnerabilità e criteri di individuazione dei ...,https://www.energiacorrente.it/servizio-di-tutela-della-vulnerabilita-e-criteri-di-individuazione-dei-clienti-vulnerabili/,"Oct 2, 2023 ... Ciascun Cliente vulnerabile dovrà inviare ad E.CO – Energia Corrente S.r.l. Unipersonale, all'indirizzo clienti@ecocre.it, una dichiarazione sostitutiva di atto ..."
