title,link,snippet
Energia: per la carbon neutrality è corsa a tre | ISPI,https://www.ispionline.it/it/pubblicazione/energia-la-carbon-neutrality-e-corsa-tre-30040,"Oct 13, 2023 ... In questa proposta di legge si prevede di fissare come obiettivo nazionale il ... Nello stesso documento viene indicato che nel 2025 l'energia rinnovabile ..."
"Comunità energetiche rinnovabili In Regione 513 progetti, Sondrio c ...",https://www.laprovinciadisondrio.it/stories/Economia/comunita-energetiche-rinnovabili-in-regione-513-progetti-sondrio-ce-o_1723637_11/,"Oct 7, 2023 ... Linkedin icon. Le “Cer” producono e condividono energia rinnovabile ... legge che prevede strumenti di ..."
"Rigassificatore, incontro tecnico tra Snam e sindacati: chiesti ...",https://www.ivg.it/2023/10/rigassificatore-incontro-tecnico-tra-snam-e-sindacati-chiesti-investimenti-su-energia-rinnovabile/,"5 days ago ... Rigassificatore, incontro tecnico tra Snam e sindacati: chiesti investimenti su energia rinnovabile ... “Il decreto legge 57 del 2023 ha inoltre introdotto l ..."
Ecco la percentuale del fabbisogno energetico coperto se i ...,https://www.sondriotoday.it/economia/provincia-sondrio-pagamento-concessionari-idroelettrici-perecentuale-copertura-fabbisogno-energia.html,3 days ago ... Il solo territorio di Valtellina e Valchiavenna copre in termini di energia prodotta fornita il 50 per cento del fabbisogno idroelettrico lombardo. ... legge ...
Case green,https://biblus.acca.it/direttiva-case-green/,"Oct 19, 2023 ... Inoltre, dall'ultimo rapporto ENEA, circa il 75% degli immobili presenti nei comuni italiani sarebbe stato realizzato prima della legge ... energia rinnovabile; ..."
"News – Notizie, Documenti e servizi al cittadino",https://comune.cittasantangelo.pe.it/notices-base/,"Oct 19, 2023 ... Presentazione della nuova Comunità Energetica Rinnovabile di Città Sant Angelo (PE). Energia che unisce, Comunità che cresce! Data: Giovedì 5 Ottobre 2023."
Comunicati Stampa — Italiano,https://www.isprambiente.gov.it/it/istituto-informa/comunicati-stampa/anno-2023,"Oct 5, 2023 ... La quota nazionale di energia rinnovabile rispetto al consumo interno lordo ... Adempimenti di legge · Accessibilità · Privacy · Note Legali · Mappa del sito ..."
Morning note: economia e finanza dai giornali - Borsa Italiana,https://www.borsaitaliana.it/borsa/notizie/radiocor/prima-pagina/dettaglio/morning-note-economia-e-finanza-dai-giornali-nRC_10102023_0825_160867645.html,"Oct 10, 2023 ... 10) Legge di bilancio: nella manovra pacchetto famiglia da 1 miliardo (Il Sole ... Ue: 42,5% dell'energia rinnovabile entro il 2030 (Il Messaggero, pag. 20) ..."
"Energia, De Pascale: ""Mobilitazione per progetto Agnes ...",https://www.ravennatoday.it/cronaca/energia-rinnovabile-de-pascale-mercalli-agnes-rigassificatore.html,"Oct 12, 2023 ... ""Abbiamo bisogno dei grandi impianti di energia rinnovabile"". Quello di ... Mercalli: ""Serve legge nazionale"". I più letti. 1. Cronaca · Far west nello ..."
"Legge di Bilancio: Aiel-Cia, confermare l'Iva ... - CIA - Agricoltori Italiani",https://www.cia.it/news/notizie/legge-di-bilancio-aiel-cia-confermare-liva-sul-pellet-al-10/,"Oct 19, 2023 ... ... energia. Un comparto che conta oltre 14.000 imprese, di cui 6.500 imprese ... rinnovabile”. Aiel-Cia e tutta la filiera legno-energia auspicano, pertanto ..."
"Gal Terra d'Arneo su energia rinnovabile: ""Il territorio rivendica il ...",https://www.trnews.it/2023/10/13/gal-terra-darneo-su-energia-rinnovabile-il-territorio-rivendica-il-diritto-alla-pianificazione/406677,"Oct 13, 2023 ... Gal Terra d'Arneo su energia rinnovabile: “Il territorio rivendica il “diritto alla pianificazione” ... “Giochi del Mediterraneo”, in Legge di Bilancio 125 ..."
Approvata la Direttiva RED III sulle energie rinnovabili | AzzeroCO2,https://www.azzeroco2.it/approvata-la-direttiva-red-iii-sulle-energie-rinnovabili/,"Oct 20, 2023 ... La legge innalza significativamente gli obiettivi dell'UE in materia di ... La direttiva rivista aggiunge inoltre obiettivi di energia rinnovabile per ..."
Con Optiturb la turbina è a noleggio,https://www.energiamercato.it/notizie/mercato/noleggio-turbina-eolica,"Oct 5, 2023 ... Nell'epoca in cui quasi tutto è disponibile in forma di servizio, gli impianti di produzione di energia rinnovabile non fanno eccezione. ... Il progetto, si legge ..."
Opere impiantistiche - FGB S.r.l.,https://www.fgbservizi.it/ser_opere_imp.php,"1 day ago ... La FGB S.r.l. è in grado di progettare e realizzare qualsiasi tipo di impianto alimentato con fonti di energia tradizionale e rinnovabile (solare-termico, ..."
Annunciato completamento del pacchetto 'Fit for 55' | FIRST | ART-ER,https://first.art-er.it/news/annunciato-completamento-del-pacchetto-fit-55,"Oct 9, 2023 ... Con l'adozione della Direttiva sull'energia rinnovabile UE revisionata e del Regolamento sull'aviazione ReFuelEU, l'UE si è posta obiettivi climatici legalmente ..."
"ARPAE Agenzia regionale per la prevenzione, l'ambiente e l'energia ...",https://apps.arpae.it/REST//media/651ebdf32b132551f06337a5,"Oct 5, 2023 ... 387/2003, LEGGE 241/1990 - IMPIANTO PER LA PRODUZIONE DI ENERGIA ... fonte energetica rinnovabile solare fotovoltaica."";. - la Legge Regionale 22 febbraio 1993 n ..."
"Energia, rinnovabile e nucleare: connubio possibile?",https://www.luinonotizie.it/2023/10/21/energia-rinnovabile-e-nucleare-connubio-possibile/447189,"7 days ago ... Argomenti: energia nucleare, energia rinnovabile, Futuro, Milano. Vuoi ... legge sia perché tali informazioni sono patrimonio di rilevanza strategica per la ..."
"Comunità energetiche, Portoferraio partecipa | Attualità ...",https://www.quinewselba.it/portoferraio-elba-comunita-energetiche-portoferraio-partecipa.htm,"Sep 30, 2023 ... - si legge in una nota dell'amministrazione comunale:- Per rispettare questo ... energia rinnovabile dal 45% circa ad oltre il 70% del fabbisogno elettrico."
ENERGIA: SERVONO POLITICHE AVANZATE | VideonotizieTV Lodi,https://www.videonotizietv.it/cronaca/energia-servono-politiche-avanzate,"2 days ago ... ... legge regionale del febbraio 2022 ancora inattuata a causa delle esitazioni ... rinnovabile, 30 miliardi di nuovi investimenti privati, crescita del PIL ed ..."
ELENA PIERRI,https://va.mite.gov.it/File/Documento/880829,"5 days ago ... Meccanismo di finanziamento dell'energia rinnovabile ... territorio, e gli altri beni individuati dalla legge o in base alla legge"". Sono altresì beni."
Edifici NZEB: l'innovazione nell'edilizia sostenibile - BibLus-BIM,https://bim.acca.it/edifici-nzeb/,"Oct 13, 2023 ... ... energia e alla produzione di energia rinnovabile. Questo porta a un notevole ... legge 10, certificazione energetica e EcoBonus. ACCA software. Search. Info."
"Energia: Ok Consiglio Ue una nuova direttiva rinnovabili, quota 42,5 ...",https://geagency.it/energia-ok-consiglio-ue-una-nuova-direttiva-rinnovabili-quota-425-entro-2030/,"Oct 9, 2023 ... Gli Stati membri al Consiglio Ue hanno adottato in via definitiva l'accordo con l'Eurocamera sulla revisione della Direttiva sull'energia rinnovabile,"
"Direttiva RED III sulle rinnovabili, via libera anche dal Consiglio ...",https://www.buildnews.it/articolo/direttiva-red-iii-rinnovabili-via-libera-anche-dal-consiglio-europeo,"Oct 10, 2023 ... Il Consiglio europeo ha adottato ieri 9 ottobre 2023 la nuova direttiva RED III sull'energia rinnovabile, per aumentare la quota di energia rinnovabile nel ..."
"Deliberazione della Giunta Regionale 23 ottobre 2023, n. 26-7599 ...",http://www.regione.piemonte.it/governo/bollettino/abbonati/2023/43/attach/dgr_07599_1050_23102023.pdf,5 days ago ... la recente normativa statale in materia di energia rinnovabile e in particolare il d.lgs. ... 61 dello Statuto e dell'articolo 5 della Legge regionale 12 ottobre ...
