title,link,snippet
"Hydronews su LinkedIn: Anche UniCredit tra i finanziatori di TES, la ...",https://it.linkedin.com/posts/hydronews_anche-unicredit-tra-i-finanziatori-di-tes-activity-6955897993988354048-TpNH?trk=public_profile_like_view,"6 days ago ... ... idrogeno Venice Sustainability Foundation https://lnkd.in/dmqu4AZa ... euro al Kg”, averte Boston Consulting Group (BCG) #hydrogen #renewables https://lnkd ..."
Gabriele Ferrero su LinkedIn: #germania #centrali #elettricità ...,https://it.linkedin.com/posts/gabrieleferrero73_germania-centrali-elettricit%C3%A0-activity-7115691780863344641-qTIX?trk=public_profile_like_view,"7 days ago ... ... €/MWh nel periodo 1-18 ottobre, con un premio di 52,70 €/MWh rispetto alla Francia ... euro per #Mwh estendendo il rialzo del 5,6% di venerdì, in mezzo alle ..."
Chiron Energy su LinkedIn: #assumendo,https://www.linkedin.com/posts/chiron-energy_assumendo-activity-7121456449318182912-NYNd,"2 days ago ... ... rinnovabile ogni anno fino al 2030; Nel 2022, i costi dell'elettricità da ... Questo rappresenta un incremento di un milione di posti di lavoro rispetto ..."
Terna SpA su LinkedIn: #terna #servizioelettrico #milanocortina ...,https://it.linkedin.com/posts/terna_terna-servizioelettrico-milanocortina-activity-7066787679287279616-JVNG?trk=public_profile_like_view,"5 days ago ... L'opera, per cui #Terna investirà 65 milioni di euro ... Un'anagrafe nazionale dei punti di produzione, #rinnovabile e non, che al momento superano il milione e ..."
Erik Rakhou on LinkedIn: How hydrogen will change our lives. Next ...,https://fi.linkedin.com/posts/erik-rakhou_how-hydrogen-will-change-our-lives-next-activity-7051796090731290626--NOQ,"Oct 17, 2023 ... Euro FPV Holdings LDA. 6mo. Report this comment; Close menu. Thank you so much Erik ... idrogeno #hidrógeno #sustainability *Note on Mercator map type - this can ..."
Casalcar Srl su LinkedIn: PRONTA CONSEGNA KIA NIRO ...,https://it.linkedin.com/posts/casalcar-srl_pronta-consegna-kia-niro-elettrica-km0-prezzo-activity-7102666289600430080-JTEG?trk=public_profile_like_view,7 days ago ... Super Promo di Settembre Nuova Kia Sportage - Anche GPL Rata a partire da 229€* 3 anni di copertura assicurativa Furto&Incendio Valore a Nuovo Finanziamento ...
Gabriele Guerrini su LinkedIn: Rate your favourite spa,https://www.linkedin.com/posts/gabriele-guerrini_rate-your-favourite-spa-activity-7051103467020406785-lVbJ?trk=public_profile_like_view,"3 days ago ... Il primo treno a idrogeno mai realizzato in Italia. wired.it. Consiglia ... Il turismo ai livelli del 2019, traina l'ecommerce a 36 miliardi di euro ..."
Gruppo Sapio su LinkedIn: Sapio_Bilancio2021-230x280 ...,https://it.linkedin.com/posts/grupposapio_bilancio-sostenibilit%C3%A0-sapio-2021-activity-7020750597465214976-oBxU?trk=public_profile_like_view,"Oct 16, 2023 ... Scopri il nostro Bilancio di Sostenibilità su: https://lnkd.in/evU7jyk8 ... Lo stato dell'arte sullo sviluppo dell'idrogeno in Italia: l'intervento del Presidente ..."
Linde Gas Italia su LinkedIn: #linde #idrogeno #linde ...,https://it.linkedin.com/posts/linde-gas-italia_linde-idrogeno-linde-activity-6770338490480701440-fZeE?trk=public_profile_like_view,"Oct 16, 2023 ... Dal 2025 ca 8.000 aziende saranno obbligate a presentare un Bilancio di ... BOC sta producendo idrogeno rinnovabile nel suo vicino sito di produzione ..."
Baglietto Yachts su LinkedIn: #baglietto #bagliettoyachts ...,https://it.linkedin.com/posts/baglietto-yachts_baglietto-bagliettoyachts-italiandesign-activity-6936318364768190464-_3kH?trk=public_profile_like_view,"Oct 18, 2023 ... ... euro. Deprati ha anche evidenziato come la crescita del comparto nautico, di ... idrogeno. #baglietto #bagliettoyachts #italiandesign #madeinitaly #yacht ..."
Erik Rakhou on LinkedIn: How hydrogen will change our lives. Next ...,https://fi.linkedin.com/posts/erik-rakhou_how-hydrogen-will-change-our-lives-next-activity-7051796090731290626--NOQ,"Oct 17, 2023 ... Euro FPV Holdings LDA. 6mo. Report this comment; Close menu. Thank you so much Erik ... idrogeno #hidrógeno #sustainability *Note on Mercator map type - this can ..."
Casalcar Srl su LinkedIn: PRONTA CONSEGNA KIA NIRO ...,https://it.linkedin.com/posts/casalcar-srl_pronta-consegna-kia-niro-elettrica-km0-prezzo-activity-7102666289600430080-JTEG?trk=public_profile_like_view,7 days ago ... Super Promo di Settembre Nuova Kia Sportage - Anche GPL Rata a partire da 229€* 3 anni di copertura assicurativa Furto&Incendio Valore a Nuovo Finanziamento ...
Gruppo Sapio su LinkedIn: Sapio_Bilancio2021-230x280 ...,https://it.linkedin.com/posts/grupposapio_bilancio-sostenibilit%C3%A0-sapio-2021-activity-7020750597465214976-oBxU?trk=public_profile_like_view,"Oct 16, 2023 ... Scopri il nostro Bilancio di Sostenibilità su: https://lnkd.in/evU7jyk8 ... Lo stato dell'arte sullo sviluppo dell'idrogeno in Italia: l'intervento del Presidente ..."
Linde Gas Italia su LinkedIn: #linde #idrogeno #linde ...,https://it.linkedin.com/posts/linde-gas-italia_linde-idrogeno-linde-activity-6770338490480701440-fZeE?trk=public_profile_like_view,"Oct 16, 2023 ... Dal 2025 ca 8.000 aziende saranno obbligate a presentare un Bilancio di ... BOC sta producendo idrogeno rinnovabile nel suo vicino sito di produzione ..."
Baglietto Yachts su LinkedIn: #baglietto #bagliettoyachts ...,https://it.linkedin.com/posts/baglietto-yachts_baglietto-bagliettoyachts-italiandesign-activity-6936318364768190464-_3kH?trk=public_profile_like_view,"Oct 18, 2023 ... ... euro. Deprati ha anche evidenziato come la crescita del comparto nautico, di ... idrogeno. #baglietto #bagliettoyachts #italiandesign #madeinitaly #yacht ..."
All Energy & Architecture srl | LinkedIn,https://uk.linkedin.com/company/all-energy-&-architecture-srl?trk=public_profile_experience-item_profile-section-card_image-click,4 days ago ... ... rinnovabile. ➡ Contattaci per una prima analisi: la nostra azienda sosterrà ... Richiedi il tuo rimborso di 400 Euro sul tuo sistema d'accumulo TESLA ...
Pasquale Manuardi su LinkedIn: Il motore di una nave gigante si è ...,https://it.linkedin.com/posts/pasquale-manuardi-4b1a91162_il-motore-di-una-nave-gigante-si-%C3%A8-rotto-activity-7115923656974725120-1crl?trk=public_profile_like_view,"Oct 17, 2023 ... ... € ""Che diavolo ?!"" ha detto il proprietario. ""Non hai fatto quasi nulla. Dacci una stima dettagliata."" La risposta è semplice: Un colpo di martello: 2€ Sai ..."
Simone Geravini su LinkedIn: #canada #calabria #innovazione,https://it.linkedin.com/posts/simonegeravini_canada-calabria-innovazione-activity-7054776774143950848-Vz17?trk=public_profile_like_view,"Oct 16, 2023 ... ... elettricità da #rinnovabili, unica soluzione STRUTTURALE per abbassare le ... euro saranno investiti nella ristrutturazione e nell'ampliamento della rete ..."
Riccardo D'Agostino su LinkedIn: #aivanhov,https://it.linkedin.com/posts/riccardo-d-agostino_aivanhov-activity-7061260213324046336-etEh,"1 day ago ... ... euro a livello nazionale per finanziare la formazione ... euro, si produrrà poi idrogeno verde nelle aree industriali dismesse. Una ..."
Opportunità di Carriera nel Settore B2B dell'Energia Rinnovabile ed ...,https://it.linkedin.com/jobs/view/opportunit%C3%A0-di-carriera-nel-settore-b2b-dell-energia-rinnovabile-ed-efficienza-energetica-unisciti-alla-nostra-squadra%21-at-hrspecialist-italia-il-tuo-nuovo-lavoro-3742877008,7 days ago ... Pubblicazione: 20:10:56. Sei alle prime esperienze lavorative e sei appassionato di energia rinnovabile e sostenibile…Vedi questa e altre offerte di lavoro ...
Opportunità di Carriera nel Settore B2B dell'Energia Rinnovabile ed ...,https://it.linkedin.com/jobs/view/opportunit%C3%A0-di-carriera-nel-settore-b2b-dell-energia-rinnovabile-ed-efficienza-energetica-unisciti-alla-nostra-squadra%21-at-hrspecialist-italia-il-tuo-nuovo-lavoro-3742874353,7 days ago ... Pubblicazione: 20:10:40. Sei alle prime esperienze lavorative e sei appassionato di energia rinnovabile e sostenibile…Vedi questa e altre offerte di lavoro ...
Watergas su LinkedIn: BFWE dall'energia all'acqua fino ai droni ...,https://www.linkedin.com/posts/watergas_bfwe-dallenergia-allacqua-fino-ai-droni-activity-7120717251636281345-dALk,"7 days ago ... IDROGENO, IL PUNTO SUI NUOVI PROGETTI PER LO SVILUPPO DEL SETTORE L'idrogeno ... gpl #metano #CCS #depurazione #servizioidrico #rigassificatore #biometano ..."
Opportunità di Carriera nel Settore B2B dell'Energia Rinnovabile ed ...,https://it.linkedin.com/jobs/view/opportunit%C3%A0-di-carriera-nel-settore-b2b-dell-energia-rinnovabile-ed-efficienza-energetica-unisciti-alla-nostra-squadra%21-at-hrspecialist-italia-il-tuo-nuovo-lavoro-3742876178,7 days ago ... Pubblicazione: 20:10:32. Sei alle prime esperienze lavorative e sei appassionato di energia rinnovabile e sostenibile…Vedi questa e altre offerte di lavoro ...
Terna SpA su LinkedIn: #ternapeople #transizioneenergetica ...,https://www.linkedin.com/posts/terna_ternapeople-transizioneenergetica-drivingenergy-activity-7064228879049068544-1PT3,"6 days ago ... Il Piano prevede circa 1 miliardo di euro di investimenti nei prossimi 10 ... Un'anagrafe nazionale dei punti di produzione, #rinnovabile e non, che al momento ..."
Gruppo Sapio | LinkedIn,https://nl.linkedin.com/company/grupposapio?trk=public_profile_experience-item_profile-section-card_image-click,"Oct 13, 2023 ... ... Euro e 2.200 collaboratori produce ... Realizzazione di sistemi di combustione idrogeno-aria e idrogeno-ossigeno per una riduzione della carbon footprint."
Kiwa Moroni su LinkedIn: #kiwaitalia #kiwamoroni #energyear ...,https://it.linkedin.com/posts/moroni_kiwaitalia-kiwamoroni-energyear-activity-7117417162763333632-IlL8?trk=public_profile_like_view,5 days ago ... Kiwa Moroni in qualità di Lender Technical Advisor nel rifinanziamento per 140 mln di euro del portfolio rinnovabile di Solegreen. kiwa.com · 21.
Linde Gas Italia | LinkedIn,https://www.linkedin.com/company/linde-gas-italia,8 days ago ... ... €. Linde plc fa parte della lista delle aziende Fortune Global 500. La ... BOC sta producendo idrogeno rinnovabile nel suo vicino sito di produzione ...
Ener2Crowd su LinkedIn: Ener2Crowd e il nuovo GreenFriend ...,https://www.linkedin.com/posts/ener2crowd_ener2crowd-e-il-nuovo-greenfriend-icopower-activity-7103026083037405184-JVLB?trk=public_profile_like_view,"Oct 13, 2023 ... ... € 100.000 ✓ Obiettivo max: € 250.000 ✓ Durata: 36 mesi ✓ Ammortamento: francese ✓ EnerScore: B ✓ Punti Ambiente per euro ... investimento - Finanza Green e ..."
Opportunità di Carriera nel Settore B2B dell'Energia Rinnovabile ed ...,https://it.linkedin.com/jobs/view/opportunit%C3%A0-di-carriera-nel-settore-b2b-dell-energia-rinnovabile-ed-efficienza-energetica-unisciti-alla-nostra-squadra%21-at-hrspecialist-italia-srls-3743429523,6 days ago ... Pubblicazione: 12:52:44. Sei alle prime esperienze lavorative e sei appassionato di energia rinnovabile e sostenibile…Vedi questa e altre offerte di lavoro ...
Opportunità di Carriera nel Settore B2B dell'Energia Rinnovabile ed ...,https://it.linkedin.com/jobs/view/opportunit%C3%A0-di-carriera-nel-settore-b2b-dell-energia-rinnovabile-ed-efficienza-energetica-unisciti-alla-nostra-squadra%21-at-hrspecialist-italia-srls-3743428609,6 days ago ... Pubblicazione: 12:53:32. Sei alle prime esperienze lavorative e sei appassionato di energia rinnovabile e sostenibile…Vedi questa e altre offerte di lavoro ...
